{
  "contractVersion": "1.0",
  "skillVersion": "0.2.0",
  "templateVersion": "0.2.0",
  "uiSnapshot": {
    "distribution": "skill-template",
    "vocabularyDigest": "b1e9cd04c195828d578d42587e854c5b4da695dff98bd2d111bd68e321879556"
  },
  "projectDigest": "776ea93b7e6a6f310f40860f8ec8c5f44c81977efe3d71875d7be6fa65b308aa",
  "inventory": {
    "sections": [
      "home",
      "vision",
      "starting",
      "workflow",
      "planning",
      "plans",
      "adr",
      "spec"
    ],
    "catalogs": [
      "glossary",
      "models",
      "policies",
      "prds",
      "stories",
      "plans",
      "adr",
      "spec-data-model",
      "spec-system-model"
    ],
    "vocabulary": [
      "Card",
      "Cards",
      "File",
      "Files",
      "Folder",
      "DocKind",
      "DocStatus",
      "AdrStatus",
      "Decision",
      "SpecVersion",
      "Canvas",
      "CanvasLegend",
      "DocsInlineToc",
      "DocsSidebarFolder",
      "indexOnlyPageTree",
      "createCatalogNavigation"
    ],
    "contentSource": "notion"
  },
  "files": {},
  "provider": {
    "notion": {
      "schemaVersion": "1.1",
      "schemaDigest": "2e1be0b1517a1c113145331496c927fc82deac78b1d970fb0fcfd9e152ebe975",
      "lastObservedAt": "2026-07-26T07:04:25.540Z",
      "lastManifestDigest": "2e1be0b1517a1c113145331496c927fc82deac78b1d970fb0fcfd9e152ebe975",
      "mappings": {
        "pages.home": {
          "id": "3a9346da-c456-8024-802c-f881896d3bd3",
          "type": "page",
          "parentKey": "root",
          "url": "https://app.notion.com/p/paxhumana/tyohnn-skills-3a9346dac4568024802cf881896d3bd3"
        }
      },
      "pendingOperationIds": [
        "ensure:pages.vision",
        "ensure:pages.starting",
        "ensure:pages.workflow",
        "ensure:pages.workflow-planning",
        "ensure:pages.development",
        "ensure:pages.domain",
        "ensure:pages.glossary",
        "ensure:dbs.glossary",
        "inline:dbs.glossary",
        "ensure:pages.models",
        "ensure:dbs.models",
        "inline:dbs.models",
        "ensure:pages.policies",
        "ensure:dbs.policies",
        "inline:dbs.policies",
        "ensure:pages.planning",
        "ensure:pages.prds",
        "ensure:dbs.prds",
        "inline:dbs.prds",
        "ensure:pages.stories",
        "ensure:dbs.stories",
        "inline:dbs.stories",
        "ensure:pages.spec",
        "ensure:pages.data-model",
        "ensure:dbs.data-model",
        "inline:dbs.data-model",
        "ensure:pages.system-model",
        "ensure:dbs.system-model",
        "inline:dbs.system-model",
        "ensure:pages.cli",
        "ensure:pages.plans",
        "ensure:dbs.plans",
        "inline:dbs.plans",
        "ensure:pages.adrs",
        "ensure:dbs.adrs",
        "inline:dbs.adrs",
        "sources:root-index",
        "relation:dbs.prds:Stories:dbs.stories",
        "relation:dbs.stories:PRDs:dbs.prds",
        "relation:dbs.plans:PRD:dbs.prds",
        "relation:dbs.plans:Stories:dbs.stories",
        "relation:dbs.plans:Specs:dbs.data-model",
        "relation:dbs.plans:Specs (System model):dbs.system-model",
        "body:pages.home",
        "body:pages.vision",
        "body:pages.starting",
        "body:pages.workflow",
        "body:pages.workflow-planning",
        "body:pages.development",
        "body:pages.domain",
        "body:pages.glossary",
        "body:pages.models",
        "body:pages.policies",
        "body:pages.planning",
        "body:pages.prds",
        "body:pages.stories",
        "body:pages.spec",
        "body:pages.data-model",
        "body:pages.system-model",
        "body:pages.cli",
        "body:pages.plans",
        "body:pages.adrs"
      ],
      "completedOperationIds": [
        "ensure:pages.home"
      ]
    }
  }
}
